{
  "$schema": "https://json-schema.org/draft/2020-12/schema",
  "$id": "https://libre-ai.fr/schemas/feed-radar/curated-item-export.v0.1.schema.json",
  "title": "CuratedItemExport v0.1",
  "type": "object",
  "additionalProperties": false,
  "required": [
    "format",
    "export_id",
    "origin_product",
    "workspace_id",
    "created_by",
    "created_at",
    "purpose",
    "privacy_classification",
    "item",
    "source_ref",
    "curation",
    "rule_evidence",
    "constraints",
    "artifact_ref",
    "provenance_ref"
  ],
  "properties": {
    "format": { "const": "feedmind.curated_item_export.v0.1" },
    "export_id": { "type": "string", "minLength": 1 },
    "origin_product": { "const": "rumble-feed-mind" },
    "workspace_id": { "type": "string", "minLength": 1 },
    "created_by": { "type": "string", "minLength": 1, "maxLength": 64 },
    "created_at": { "$ref": "#/$defs/rfc3339Timestamp" },
    "purpose": { "const": "local_export" },
    "privacy_classification": { "enum": ["public", "normal"] },
    "item": { "$ref": "#/$defs/curatedItem" },
    "source_ref": { "$ref": "#/$defs/sourceRef" },
    "curation": { "$ref": "#/$defs/curation" },
    "rule_evidence": {
      "type": "array",
      "minItems": 1,
      "items": { "$ref": "#/$defs/ruleEvidence" }
    },
    "constraints": { "$ref": "#/$defs/exportConstraints" },
    "artifact_ref": { "$ref": "#/$defs/artifactRef" },
    "provenance_ref": { "$ref": "#/$defs/provenanceRef" }
  },
  "$defs": {
    "sha256": {
      "type": "string",
      "pattern": "^sha256:[0-9a-fA-F]{64}$"
    },
    "rfc3339Timestamp": {
      "type": "string",
      "pattern": "^\\d{4}-\\d{2}-\\d{2}T\\d{2}:\\d{2}:\\d{2}Z$"
    },
    "nullableTimestamp": {
      "oneOf": [
        { "$ref": "#/$defs/rfc3339Timestamp" },
        { "type": "null" }
      ]
    },
    "nullableBoundedTitle": {
      "oneOf": [
        { "type": "string", "maxLength": 300 },
        { "type": "null" }
      ]
    },
    "curatedItem": {
      "type": "object",
      "additionalProperties": false,
      "required": [
        "item_id",
        "title",
        "content_excerpt",
        "content_hash",
        "source_url_hash",
        "published_at",
        "tags"
      ],
      "properties": {
        "item_id": { "type": "string", "minLength": 1 },
        "title": { "type": "string", "minLength": 1, "maxLength": 300 },
        "content_excerpt": { "type": "string", "maxLength": 2000 },
        "content_hash": { "$ref": "#/$defs/sha256" },
        "source_url_hash": { "$ref": "#/$defs/sha256" },
        "published_at": { "$ref": "#/$defs/nullableTimestamp" },
        "tags": {
          "type": "array",
          "maxItems": 64,
          "items": { "type": "string", "maxLength": 64 }
        }
      }
    },
    "sourceRef": {
      "type": "object",
      "additionalProperties": false,
      "required": [
        "source_id",
        "source_type",
        "origin_product",
        "content_hash",
        "provenance_id",
        "opml_title",
        "opml_feed_count",
        "first_feed_title"
      ],
      "properties": {
        "source_id": { "type": "string", "minLength": 1 },
        "source_type": { "enum": ["feed_item", "url", "document", "artifact"] },
        "origin_product": { "const": "rumble-feed-mind" },
        "content_hash": { "$ref": "#/$defs/sha256" },
        "provenance_id": { "type": "string", "minLength": 1 },
        "opml_title": { "$ref": "#/$defs/nullableBoundedTitle" },
        "opml_feed_count": { "type": "integer", "minimum": 0 },
        "first_feed_title": { "$ref": "#/$defs/nullableBoundedTitle" }
      }
    },
    "curation": {
      "type": "object",
      "additionalProperties": false,
      "required": ["decision", "reason", "curated_by", "curated_at"],
      "properties": {
        "decision": { "enum": ["saved", "rejected", "tagged", "exported"] },
        "reason": { "type": "string", "minLength": 1, "maxLength": 1000 },
        "curated_by": { "type": "string", "minLength": 1, "maxLength": 64 },
        "curated_at": { "$ref": "#/$defs/rfc3339Timestamp" }
      }
    },
    "ruleEvidence": {
      "type": "object",
      "additionalProperties": false,
      "required": ["rule_id", "decision", "explanation", "evidence_hash", "confidence"],
      "properties": {
        "rule_id": { "type": "string", "minLength": 1 },
        "decision": { "enum": ["match", "no_match", "manual_override", "not_evaluated"] },
        "explanation": { "type": "string", "minLength": 1, "maxLength": 1000 },
        "evidence_hash": { "$ref": "#/$defs/sha256" },
        "confidence": { "type": "number", "minimum": 0, "maximum": 1 }
      }
    },
    "exportConstraints": {
      "type": "object",
      "additionalProperties": false,
      "required": [
        "contains_raw_private_content",
        "contains_secrets",
        "contains_byok_material",
        "allow_downstream_execution",
        "data_residency",
        "retention_policy_ref"
      ],
      "properties": {
        "contains_raw_private_content": { "const": false },
        "contains_secrets": { "const": false },
        "contains_byok_material": { "const": false },
        "allow_downstream_execution": { "const": false },
        "data_residency": { "type": "string", "minLength": 1 },
        "retention_policy_ref": { "type": "string", "minLength": 1 }
      }
    },
    "artifactRef": {
      "type": "object",
      "additionalProperties": false,
      "required": ["artifact_id", "artifact_type", "hash", "manifest_ref"],
      "properties": {
        "artifact_id": { "type": "string", "minLength": 1 },
        "artifact_type": { "const": "curated_export" },
        "hash": { "$ref": "#/$defs/sha256" },
        "manifest_ref": { "type": "string", "minLength": 1 }
      }
    },
    "provenanceRef": {
      "type": "object",
      "additionalProperties": false,
      "required": ["provenance_id", "operation", "timestamp"],
      "properties": {
        "provenance_id": { "type": "string", "minLength": 1 },
        "operation": { "enum": ["created", "imported", "transformed", "exported", "indexed"] },
        "timestamp": { "$ref": "#/$defs/rfc3339Timestamp" }
      }
    }
  }
}
