{
  "format": "feedmind.curated_item_export.v0.1",
  "export_id": "export:6b01c344dbe5827bec3e711f",
  "origin_product": "rumble-feed-mind",
  "workspace_id": "workspace:local-demo",
  "created_by": "actor-demo-local",
  "created_at": "2026-07-01T00:02:00Z",
  "purpose": "local_export",
  "privacy_classification": "normal",
  "item": {
    "item_id": "11111111-1111-4111-8111-111111111111",
    "title": "Rust-first local feed curation without silent failures",
    "content_excerpt": "Rust and local-first workflows make feed curation auditable.",
    "content_hash": "sha256:122a0630946b94e508a626da3b137d8c5405ca9df8b63ba9fde102c4cc178163",
    "source_url_hash": "sha256:2824100bca95c68566cd0cc42ef639188de088041c6943fc83c4d051bdcd3de6",
    "published_at": "2026-07-01T00:00:00Z",
    "tags": [
      "rust",
      "sovereignty"
    ]
  },
  "source_ref": {
    "source_id": "source:6b01c344dbe5827bec3e711f",
    "source_type": "feed_item",
    "origin_product": "rumble-feed-mind",
    "content_hash": "sha256:122a0630946b94e508a626da3b137d8c5405ca9df8b63ba9fde102c4cc178163",
    "provenance_id": "provenance:export:6b01c344dbe5827bec3e711f",
    "opml_title": "FeedMind demo subscriptions",
    "opml_feed_count": 2,
    "first_feed_title": "Clever Cloud Blog"
  },
  "curation": {
    "decision": "saved",
    "reason": "Keep Rust sovereignty articles",
    "curated_by": "actor-demo-local",
    "curated_at": "2026-07-01T00:02:00Z"
  },
  "rule_evidence": [
    {
      "rule_id": "rule:3ed86b5d6ef0d9bb",
      "decision": "match",
      "explanation": "Title matches pattern: (?i)(rust|sovereign|local-first)",
      "evidence_hash": "sha256:ef16a2af327c962a100b861bdf452bcde87fe1c8ecbf9a48e83ddce6e6b69b46",
      "confidence": 1.0
    }
  ],
  "constraints": {
    "contains_raw_private_content": false,
    "contains_secrets": false,
    "contains_byok_material": false,
    "allow_downstream_execution": false,
    "data_residency": "EU/local-first",
    "retention_policy_ref": "retention:feedmind-local-demo"
  },
  "artifact_ref": {
    "artifact_id": "artifact:export:6b01c344dbe5827bec3e711f",
    "artifact_type": "curated_export",
    "hash": "sha256:ea21f8b026b4ac6598d1e54df7f8f692a8c8d50c1c057b19f240311a81af3c36",
    "manifest_ref": "manifest:feedmind-local-demo"
  },
  "provenance_ref": {
    "provenance_id": "provenance:export:6b01c344dbe5827bec3e711f",
    "operation": "exported",
    "timestamp": "2026-07-01T00:02:00Z"
  }
}
